i18n-intro-text	{richestName}'s wealth is quite literally unimaginable.
i18n-we-rarely-see-wealth	We rarely see wealth inequality represented to scale. This is part of the reason people <a href="https://academic.oup.com/pnasnexus/article/3/9/pgae333/7756543" target="_blank" rel="noopener noreferrer">consistently underestimate</a> the relative wealth of the super rich.
i18n-every-10-pixels	Every 10 pixels you scroll is {scrollRate}.
i18n-ok-were-coming-up	OK, we're coming up on the end now.
i18n-lol-just-kidding	Lol, just kidding, we're only about ? of the way. Keep scrolling though, there's more to see.
i18n-lets-put-this-wealth	Let's put this wealth in perspective by comparing it to some familiar things.
i18n-yearly-earnings-american	Yearly income of the median American (<a href="https://www.bls.gov/news.release/wkyeng.t01.htm" target="_blank" rel="noopener noreferrer"> ~$63,180 </a>)
i18n-seat-belt	How much Elon Musk makes while buckling his seatbelt (4 seconds, <a href="https://www.forbes.com/sites/pr/2026/03/10/forbes-40th-annual-worlds-billionaires-list-elon-musk-is-worlds-richest-person-ever-recorded/" target="_blank" rel="noopener noreferrer"> ~$63,420 </a>)
i18n-average-cost-house	The average cost of a house in the United States (<a href="https://fred.stlouisfed.org/series/MSPUS" target="_blank" rel="noopener noreferrer"> $405,300 </a>)
i18n-instant-coffee	How much Elon Musk makes in the time it takes to make a cup of instant coffee (1 minute, <a href="https://www.forbes.com/sites/pr/2026/03/10/forbes-40th-annual-worlds-billionaires-list-elon-musk-is-worlds-richest-person-ever-recorded/" target="_blank" rel="noopener noreferrer"> ~$951,000 </a>)
i18n-lifetime-earnings-american	All the money the median American will earn in their entire lifetime (<a href="https://www.bls.gov/news.release/wkyeng.t01.htm" target="_blank" rel="noopener noreferrer"> ~$2.5 million</a>)
i18n-lifetime-earnings-poorest-half	For the poorest half of humanity — 2.8 billion adults — average income is just <a href="https://wir2026.wid.world/insight/global-economic-inequity/" target="_blank" rel="noopener noreferrer"> $5,100 per year</a>, or about $200,000 in a lifetime.
i18n-even-the-fortunes-of-the-wealthy	Even the fortunes of the wealthy and very rich people are dwarfed by the incomprehensible wealth of the 0.0001%.
i18n-lifetime-earnings-lawyer	Lifetime earnings of a US lawyer (on average <a href="https://www.bls.gov/ooh/legal/lawyers.htm" target="_blank" rel="noopener noreferrer"> ~$6 million </a>)
i18n-lifetime-earnings-doctor	Lifetime earnings of a US doctor (on average <a href="https://www.medrxiv.org/content/10.1101/2025.08.19.25333972v1.full" target="_blank" rel="noopener noreferrer"> ~$6.5 million </a>)
i18n-estimated-wealth-ryan-gosling	Estimated wealth of Ryan Gosling (<a href="https://www.celebritynetworth.com/richest-celebrities/actors/ryan-gosling-net-worth/" target="_blank" rel="noopener noreferrer"> ~$70 million </a>)
i18n-movie-barbie	How much Elon Musk makes while watching a movie starring Ryan Gosling (Barbie, 114 minutes, <a href="https://www.forbes.com/sites/pr/2026/03/10/forbes-40th-annual-worlds-billionaires-list-elon-musk-is-worlds-richest-person-ever-recorded/" target="_blank" rel="noopener noreferrer"> ~$108 million </a>)
i18n-gosling-musk-comparison	We tend to put people like Ryan Gosling and Elon Musk in the same mental category: 'rich people.' But Ryan Gosling is about 12,000x closer to you than to Elon Musk.
i18n-estimated-wealth-david-solomon	Estimated wealth of Goldman Sachs CEO David Solomon (<a href="https://www.celebritynetworth.com/richest-businessmen/wall-street/david-solomon-net-worth/" target="_blank" rel="noopener noreferrer"> ~$400 million </a>)
i18n-every-night-while-sleeping	How much Elon Musk makes every night while he is sleeping (8 hours, <a href="https://www.forbes.com/sites/pr/2026/03/10/forbes-40th-annual-worlds-billionaires-list-elon-musk-is-worlds-richest-person-ever-recorded/" target="_blank" rel="noopener noreferrer"> ~$456 million </a>)
i18n-oppose-inequality-policies	These people may see themselves as fabulously rich, and often oppose policies aimed at reducing inequality
i18n-gulf-between-super-rich	But many have not fully grasped the enormous gulf between themselves and the super rich.
i18n-elon-musk-daily-income	Elon Musk could've spent $1 billion every single day in 2025 and his wealth still would've grown by <a href="https://www.forbes.com/sites/pr/2026/03/10/forbes-40th-annual-worlds-billionaires-list-elon-musk-is-worlds-richest-person-ever-recorded/" target="_blank" rel="noopener noreferrer"> ~$370 million </a> each day.
i18n-elon-musk-2025-income	His wealth increased by <a href="https://www.forbes.com/sites/pr/2026/03/10/forbes-40th-annual-worlds-billionaires-list-elon-musk-is-worlds-richest-person-ever-recorded/" target="_blank" rel="noopener noreferrer"> ~$500 billion </a> in 2025 alone, which equals the <a href="https://www.worldometers.info/gdp/gdp-by-country/?source=imf&region=worldwide&year=2026&metric=nominal" target="_blank" rel="noopener noreferrer"> entire annual GDP of Denmark </a>.
i18n-wealth-counter-message	While you've been scrolling through this, Elon Musk's wealth has increased by approximately <strong><span id="wealth-counter">$0</span></strong>.
i18n-richest-wealth-larger-than-gdp	{richestName}'s wealth is larger than the entire annual GDP of all but <a href="https://www.worldometers.info/gdp/gdp-by-country/?source=imf&region=worldwide&year=2026&metric=nominal" target="_blank" rel="noopener noreferrer"> 22 countries </a>.
i18n-jesus-christ-spending	If he had spent $1 million every single day since the birth of Jesus Christ, he'd still have ~$100 billion left. (assuming his wealth never grew further)
i18n-how-long-to-earn-richest-wealth	The average American would have to work for over 14 million years to earn this much money.
i18n-first-humans	~300,000 years ago, the first humans (<a href="https://en.wikipedia.org/wiki/Human" target="_blank" rel="noopener noreferrer"> Homo sapiens </a>) emerged in Africa.
i18n-first-humans-comparison	So the average American would have to work ~50 times longer than our species has existed to earn Elon Musk's current wealth.
i18n-wealth-in-bills	If you laid out Elon Musk's wealth in $100 bills, it would stretch to the moon and back ~1.7 times.
i18n-wealth-absurdity	Ok, I think we've established by now how absurd this kind of wealth is.
i18n-but-does-it-matter	But does that matter? Isn't this just how capitalism works?
i18n-reason-to-change	Well, yes. And maybe that's a reason to change it. Consider this: Elon Musk's wealth isn't just sitting in a bank account.
i18n-money-equals-power	At this scale, wealth isn't just money. It's power — over what gets built, who gets elected, and which stories get told.
i18n-twitter-acquisition	Just one example: In 2022 Musk bought Twitter for $44 billion  (5% of his current wealth) and reshaped what billions of people see, read and believe.
i18n-alternative-world	We can have a world in which wealthy people exist, without handing nearly all money to the super rich.
i18n-no-single-human	No single human needs or deserves this much wealth.
i18n-richest-not-only-one	But Elon Musk is not the only one with such an absurd level of wealth that it's really not comprehensible anymore.
i18n-all-billionaires-intro	The wealth of Elon Musk may seem staggering, but it is a drop in the ocean compared to the combined wealth of all <a href="https://www.forbes.com/sites/pr/2026/03/10/forbes-40th-annual-worlds-billionaires-list-elon-musk-is-worlds-richest-person-ever-recorded/" target="_blank" rel="noopener noreferrer"> ~{billionaireCount} billionaires on Earth</a>: {allBillionairesFormatted}.
i18n-a-trillion-dollars	A trillion dollars is such a large figure that you might as well say "eleventy gajillion zillion dollars." So let's try to understand this by looking at what could be accomplished with fractions of this wealth.
i18n-billionaires-number	As we proceed, try to keep in mind: all of this wealth is controlled by a group so small that they could fit in a single mid-sized concert hall.
i18n-billionaires-concert-hall	Visual of Eventim Apollo.
i18n-disclaimer	Before we start, a quick note: <br> The numbers below are <strong>estimates</strong>, based on the best publicly available sources I could find (linked throughout). Exact figures vary by methodology and change over time, but the goal here is to convey the <strong>order of magnitude</strong>—the scale of what could be achieved—not perfect precision.
i18n-1-percent-of-money	<span style="font-size:1.4em"><strong>Let's start small: What could we do with less than 1% of the money?</strong></span>
i18n-end-malaria	Eradicate Malaria
i18n-malaria-children	In 2024, there were an estimated 282 million cases of malaria and 610,000 deaths. Most of these deaths <a href="https://www.who.int/news-room/fact-sheets/detail/malaria" target="_blank" rel="noopener noreferrer"> (95%)</a> were in the African region, where <a href="https://www.who.int/news-room/fact-sheets/detail/malaria" target="_blank" rel="noopener noreferrer">75%</a> of the deaths were <strong>children under five</strong>. That's around 434,000 children.
i18n-malaria-preventable-deaths	All of these deaths are preventable. Treating and preventing malaria is a well understood science, universally practiced in the developed world. <br><br> <a href="https://pmc.ncbi.nlm.nih.gov/articles/PMC5584487/" target="_blank" rel="noopener noreferrer">It's estimated</a> we could get on track to basically eradicate malaria globally by 2030 with an investment of ~$102 billion total. That would only be around 0.51% of the total wealth of all billionaires.
i18n-malaria-deaths-today	Around 1670 people will die from malaria today. A small group of absurdly rich people could stop it for a sum of money so small, that they would likely never even notice its absence. But they choose not to.
i18n-not-only-malaria	But Malaria is not the only infectious disease that we could treat or end for a fraction of billionaire wealth. So let's look at some other examples.
i18n-5-percent-of-money	<span style="font-size:1.4em"><strong> What could we do with less than 5% of the money?</strong></span>
i18n-end-tuberculosis	End Tuberculosis
i18n-end-hiv-aids	End HIV/AIDS
i18n-end-hepatitis	Eliminate Hepatitis B & C
i18n-end-AMR	Combat Antimicrobial resistance (AMR)
i18n-infectious-diseases-combined	All of the Above — Combined
i18n-not-only-infectious-diseases	But infectious diseases are not the only global health challenges that are technically solved and we could address with more funding. So let's take a second and look at some other examples from the healthcare sector.
i18n-end-lead-poisoning	Eliminate Lead Poisoning
i18n-lead-poisoning-investment-return	Even if you wouldn't care about the deaths caused by lead poisoning and only look at the money, every dollar invested in interventions returns <a href="https://www.worldbank.org/en/news/infographic/2025/10/23/massive-returns-economic-efficiency-of-interventions-to-prevent-and-reduce-lead-pollution" target="_blank" rel="noopener noreferrer">hundreds or even thousands of dollars</a> in benefits. Not doing this is absolute insanity, yet it's still a problem in many parts of the world.
i18n-one-percent-of-money	Good job, you've already scrolled through <strong>1%</strong> of all billionaire wealth. Keep in mind that every single pixel you scroll still represents <strong>$1,000</strong>. <br><br> There's a lot left to explore, so let's keep going.
i18n-end-blindness	End Preventable Blindness
i18n-end-blindness-2	A total investment of just <a href="https://visionatlas.iapb.org/wp-content/uploads/2025/09/The-Value-of-Vision_Full-Report.pdf" target="_blank" rel="noopener noreferrer">$7.1 billion</a> from 2025-2030 would result in <br> - 198 million fewer people with near vision impairment <br> - 24 million fewer people with mild vision impairment <br> - 30 million fewer people with moderate to severe visual impairment<br> - 3 million fewer people with blindness. <br> Apart from the health benefits, this investment would return $28 for every $1 invested.
i18n-hearing-care	Universal Hearing Care
i18n-basic-needs	But curing health conditions is only half the battle when billions still lack basic needs and the infrastructure to stay healthy in the first place.
i18n-10-percent-of-money	<span style="font-size:1.4em"><strong> So let's take a look at what could we do with less than 10% of the money?</strong></span>
i18n-clean-water-sanitation	Clean Water & Sanitation for Everyone
i18n-water-and-sanitation-deaths	Fixing this would cost about <a href="https://documents1.worldbank.org/curated/en/847191468000296045/pdf/103172-PUB-Box394556B-PUBLIC-EPI-K8632-ADD-SERIES.pdf" target="_blank" rel="noopener noreferrer">$114 billion per year</a> and would save a life every 22 seconds. That's less than a third of what we spend on <a href="https://magazica.com/global-and-regional-spending-on-cosmetics-and-beauty-products-2025-2026/" target="_blank" rel="noopener noreferrer">cosmetics every year</a>. Every $1 invested would yield an average <a href="https://www.copenhagenconsensus.com/sites/default/files/water_sanitation_assessment_-_hutton.pdf" target="_blank" rel="noopener noreferrer">$6.80</a> in returns.
i18n-end-hunger	End World Hunger
i18n-end-hunger-2	Let that sink in for a second. For less than <strong>2.5%</strong> of all billionaires' wealth, we could completely end world hunger. Yet we let millions of people go hungry every day in a world that produces more than enough food for everyone.
i18n-food-preparation	But people don't just need food, they also need the means to prepare it properly.
i18n-clean-cooking	Clean Cooking for All
i18n-electricity-access	And while we're on the topic of cooking, let's not forget that people also need electricity to power their stoves, refrigerators and other appliances that are essential for a healthy life.
i18n-electricity-for-all	Electricity for Everyone
i18n-health-and-basic-needs-combined	All health and basic needs combined:
i18n-health-and-basic-needs-combined-2	These interventions would prevent untold suffering, save millions of lives every year, completely transform the lives of billions of people, and create trillions of dollars in economic benefits.
i18n-health-and-basic-needs-combined-3	And the truly crazy part? The world's billionaires could fund all of this and wouldn't even lose money.
i18n-health-and-basic-needs-combined-4	Last year alone, their wealth grew by <a href="https://www.forbes.com/sites/pr/2026/03/10/forbes-40th-annual-worlds-billionaires-list-elon-musk-is-worlds-richest-person-ever-recorded/" target="_blank" rel="noopener noreferrer">$4 trillion</a>. So they could've funded all of the above for ~$2 trillion and still would've gotten richer by the same amount.
i18n-health-and-basic-needs-combined-5	So far, we've been talking about survival. But people deserve more than just not dying. So let's talk about <strong>opportunity</strong> — the chance to build a life, not just survive.
i18n-30-percent-of-money	<span style="font-size:1.4em"><strong> What could we do with ~30% of the money?</strong></span>
i18n-universal-education	Universal Education
i18n-education-children	These children are not missing school because they don't want to attend, but because they don't have access to it. They are missing out on the opportunity to learn, grow and build a better future for themselves and their communities. 
i18n-end-extreme-poverty	End Extreme Poverty
i18n-end-extreme-poverty-2	1 in 10 people in the world live in extreme poverty. But since 1990, <a href="https://unstats.un.org/sdgs/report/2025/goal-01/" target="_blank" rel="noopener noreferrer">1.5 billion people</a> have been lifted out of extreme poverty. So we know how it works. We know the costs. The only question is whether we're willing to do it.
i18n-trapped-intro	But millions of people aren't just poor — they're <strong>trapped</strong>.
i18n-end-forced-labor	End Forced Labor
i18n-child-labor	But forced labor is not the only remaining issue. Even though the world pledged to end child labor by 2025, it's still a huge issue. <a href="https://www.unicef.org/press-releases/despite-progress-child-labour-still-affects-138-million-children-globally-ilo-unicef" target="_blank" rel="noopener noreferrer">138 million children</a> are still in child labor — including 54 million in hazardous work.
i18n-child-labor-2	The most recent cost figures I could find estimated that an investment of <a href="https://www.ilo.org/resource/news/new-ilo-study-says-economic-benefits-eliminating-child-labour-will-vastly" target="_blank" rel="noopener noreferrer">$760 billion</a> could end child labor, however this number is from 2004 and therefore quite outdated. That's why I didn't include it in my calculations. But given that child labor is closely linked to poverty, education and forced labor, we can assume that it would be significantly reduced by the interventions I already mentioned.
i18n-universal-healthcare-intro	Education gives people opportunity. Ending poverty and exploitation gives them freedom. Now let's see what it would cost to provide a healthcare system so they have a chance to actually enjoy both.
i18n-universal-healthcare	Universal Healthcare (UHC)
i18n-universal-healthcare-2	It covers the full continuum of essential health services, from health promotion to prevention, treatment, rehabilitation and palliative care across the life course.
i18n-universal-healthcare-3	The cost of delivering complete universal health coverage (UHC) across all low- and middle-income countries (LMICs) is estimated at <a href="https://www.who.int/news-room/fact-sheets/detail/universal-health-coverage-(uhc)" target="_blank" rel="noopener noreferrer">$2.5 trillion per year</a>.
i18n-all-human-focused-causes-combined	Everything I've listed so far combined:
i18n-all-human-focused-causes-combined-2	It means a child born in the future — anywhere on Earth — could grow up fed, educated, healthy, and free. Not in some distant utopia — in a few years, with money that already exists.
i18n-all-human-focused-causes-combined-3	About $2.93 trillion of the $5.5 trillion total comes from ongoing yearly costs. But remember that the world's billionaires got richer by about $4 trillion last year alone.
i18n-all-human-focused-causes-combined-4	If this trend continues, they could still fund all of this indefinitely and never run out of money. And some causes overlap, so the actual combined cost could be lower. But as I said in the beginning, it's not about the exact numbers anyway. It's about getting <strong>perspective</strong> on the scale of their absurd wealth and the problems we could solve with it.
i18n-66-percent-of-money	<span style="font-size:1.4em"><strong> What could we do with ~66% of the money?</strong></span>
i18n-planet-intro	We didn't even reach the 30% mark yet, so let's dare to dream even bigger and turn our attention to the planet we all share.
i18n-climate-crisis-intro	Because here's the thing: none of this matters in the long run if the planet itself is falling apart.
i18n-climate-crisis-intro-2	The climate crisis doesn't just add new problems, it makes every single one above worse. More hunger. More disease. More poverty. More displacement. More suffering.
i18n-climate-crisis-intro-3	It's one of the greatest threats humanity has ever faced. And somehow, we've decided we can't afford to deal with it properly while a fewer than 3,500 people sit on more than $20 trillion.
i18n-climate-richest-emissions	The richest 0.1% of the world emit more carbon in a single day than someone from the poorest 50% emits in an entire year. Since 1990, the richest 0.1% have <a href="https://www.oxfam.org/en/press-releases/person-richest-01-produces-more-carbon-pollution-day-someone-bottom-50-produces-all" target="_blank" rel="noopener noreferrer">increased their share of global emissions by 32%</a> — while the share of the poorest half of humanity actually fell.
i18n-climate-adaptation	Climate Adaptation for Developing Countries
i18n-climate-injustice	The people least responsible for emissions are being asked to pay the highest price. <a href="https://www.who.int/news-room/fact-sheets/detail/climate-change-and-health" target="_blank" rel="noopener noreferrer">250,000 additional deaths per year</a> are projected from 2030-2050 from undernutrition, malaria, diarrhea, and heat stress alone.
i18n-climate-displacement	At the end of 2024, <a href="https://www.internal-displacement.org/publications/2025-global-report-on-internal-displacement-grid/" target="_blank" rel="noopener noreferrer">83.4 million people</a> were living in internal displacement — more than twice as many as just six years earlier. Many of them fled floods, droughts and storms made worse by a crisis they didn't cause.
i18n-land-restoration	Restore Degraded Land
i18n-biodiversity	Every time an ecosystem collapses, it takes species with it — species that took millions of years to evolve and will never come back. Scientists estimate the current extinction rate is <a href="https://www.worldwildlife.org/resources/explainers/what-is-the-sixth-mass-extinction-and-what-can-we-do-about-it/">1,000 to 10,000 times higher</a> than the natural rate.
i18n-ocean-cleanup	Clean Up the Great Pacific Garbage Patch
i18n-GPGP-cost-comparison	$7.5 billion. That's what it would cost to clean up the largest garbage patch in the ocean. The world's billionaires made that much in ~16 hours last year.
i18n-end-deforestation	End Tropical Deforestation
i18n-forests-importance	Forests aren't just trees. They're the lungs, the pharmacy, and the water filter of the planet. When they burn, everything we've been trying to fix gets harder.
i18n-energy-transition	Close the Energy Transition Gap
i18n-climate-air-crisis	This wouldn't only solve the energy transition gap, it would also save millions of lives.  Outdoor air pollution (overwhelmingly from burning fossil fuels) kills <a href="https://www.who.int/news-room/fact-sheets/detail/ambient-(outdoor)-air-quality-and-health">4.2 million people</a> every year. The energy transition we just funded also provides clean air.
i18n-air-pollution	And this would benefit everyone. Almost <a href="https://www.who.int/data/gho/data/themes/air-pollution">every person on Earth</a> (99% of the global population) breathes air that doesn't meet WHO guidelines.
i18n-major-crises-solvable	If you've made it this far, you've scrolled past the solutions to many major crises humanity faces. Disease. Hunger. Poverty. Exploitation. The climate. Every single one of them solvable. Every single one of them affordable.
i18n-grand-summary	ALL of the Above — Combined
i18n-cost-interval	That includes the total cost of all interventions (some until 2030) plus the yearly costs of Universal Healthcare, ending extreme poverty and provide clean water and sanitation. It would take an additional $2.93 trillion yearly to fund these 3 causes further (~73% of what billionaires gained last year).
i18n-transform-civilization	These programs combined would completely transform our world. Millions of lives saved. Billions rescued from poverty and disease. The planet's ecosystems restored. <strong>By inconveniencing just ~3,400 people, the entire human race could advance to a new, unprecedented level of development.</strong>
i18n-still-billionaires	And <strong>all of them</strong> would still be billionaires afterwards.
i18n-money-only-on-paper	A common objection is that their wealth is mostly in shares, so it only exists on paper. It's interesting that this argument only comes up when we talk about redistribution. When they want to buy Twitter for $44 billion, the money is suddenly very real.
i18n-could-redistribute	But that's a topic for another time. The fact is:<br>their wealth is not just on paper. It's real and growing faster than they can spend it. And if we wanted to, we could redistribute it to solve major global problems and they would still be absurdly wealthy afterwards.
i18n-systemic-problem	Instead, we're living in a system that redistributes wealth from the bottom to the top. <strong>For every dollar of new wealth in the world economy since 2000, <a href="https://oi-files-d8-prod.s3.eu-west-2.amazonaws.com/s3fs-public/2026-01/EN%20-%20Resisting%20the%20Rule%20of%20the%20Rich_0.pdf" target="_blank" rel="noopener noreferrer">41 cents went to the richest 1%</a>, and only 1 cent to the whole bottom half of humanity.</strong>
i18n-developing-countries-debt	That's also the reason why developing countries can't fund the solutions to their problems themselves. They have a total debt of <a href="https://unctad.org/news/debt-crisis-developing-countries-external-debt-hits-record-114-trillion" target="_blank" rel="noopener noreferrer">$11.4 trillion</a>. That's less than the wealth of all billionaires, but they have to pay <a href="https://www.worldbank.org/en/news/press-release/2024/12/03/developing-countries-paid-record-1-4-trillion-on-foreign-debt-in-2023" target="_blank" rel="noopener noreferrer">$1.4 trillion</a> in interest payments for it every year.
i18n-debt-interest-payments	That money could build schools, hospitals, and other essential infrastructure to improve people's lives. But it goes to interest payments to the richest people in the world instead.
i18n-systemic-problem-2	This is not just about charity. It is about a system where countries have to borrow money at high interest to buy basic medicines — while the richest people on Earth accumulate wealth faster than anyone could possibly spend it.
i18n-moral-question	Given the choice between millions of preventable deaths, and slightly reducing the fortunes of a few thousand ultra-wealthy people, how could anyone conclude that the deaths are preferable?
